{
  "$schema": "https://json-schema.org/draft/2020-12/schema",
  "$id": "https://lentic-pipe.local/schemas/closure-p1-sequence-seed-314159-patch-lock-v1.json",
  "title": "Closure V1 P1 sequence seed 314159 patch lock",
  "$defs": {
    "sha256": {
      "type": "string",
      "pattern": "^[0-9a-f]{64}$"
    },
    "gitOid": {
      "type": "string",
      "pattern": "^[0-9a-f]{40}$"
    },
    "repoPath": {
      "type": "string",
      "minLength": 1
    },
    "fileRecord": {
      "type": "object",
      "additionalProperties": false,
      "required": ["path", "role", "bytes", "sha256"],
      "properties": {
        "path": {"$ref": "#/$defs/repoPath"},
        "role": {"type": "string", "minLength": 1},
        "bytes": {"type": "integer"},
        "sha256": {"$ref": "#/$defs/sha256"}
      }
    },
    "diffEntry": {
      "type": "object",
      "additionalProperties": false,
      "required": ["status", "path"],
      "properties": {
        "status": {"enum": ["A", "M"]},
        "path": {"$ref": "#/$defs/repoPath"}
      }
    },
    "commandEvidence": {
      "type": "object",
      "additionalProperties": false,
      "required": [
        "command",
        "returncode",
        "stdout_sha256",
        "stderr_sha256",
        "stdout_line_count",
        "stderr_line_count"
      ],
      "properties": {
        "command": {
          "type": "array",
          "minItems": 1,
          "items": {"type": "string", "minLength": 1}
        },
        "returncode": {"const": 0},
        "stdout_sha256": {"$ref": "#/$defs/sha256"},
        "stderr_sha256": {"$ref": "#/$defs/sha256"},
        "stdout_line_count": {"type": "integer"},
        "stderr_line_count": {"type": "integer"}
      }
    },
    "focusedCommandEvidence": {
      "type": "object",
      "additionalProperties": false,
      "required": [
        "command",
        "returncode",
        "stdout_sha256",
        "stderr_sha256",
        "stdout_line_count",
        "stderr_line_count",
        "test_count",
        "skipped_count",
        "deselected_count"
      ],
      "properties": {
        "command": {
          "type": "array",
          "minItems": 1,
          "items": {"type": "string", "minLength": 1}
        },
        "returncode": {"const": 0},
        "stdout_sha256": {"$ref": "#/$defs/sha256"},
        "stderr_sha256": {"$ref": "#/$defs/sha256"},
        "stdout_line_count": {"type": "integer"},
        "stderr_line_count": {"type": "integer"},
        "test_count": {"type": "integer"},
        "skipped_count": {"const": 0},
        "deselected_count": {"const": 0}
      }
    },
    "schemaSubsetPreflight": {
      "type": "object",
      "additionalProperties": false,
      "required": [
        "gate",
        "schema_path",
        "schema_bytes",
        "schema_sha256",
        "supported_subset_verified",
        "minimum_keyword_absent",
        "format_keyword_absent"
      ],
      "properties": {
        "gate": {"const": "E0-MN"},
        "schema_path": {
          "const": "configs/closure_v1/p1_sequence_seed_314159_patch_lock.schema.json"
        },
        "schema_bytes": {"type": "integer"},
        "schema_sha256": {"$ref": "#/$defs/sha256"},
        "supported_subset_verified": {"const": true},
        "minimum_keyword_absent": {"const": true},
        "format_keyword_absent": {"const": true}
      }
    },
    "componentSet": {
      "type": "object",
      "additionalProperties": false,
      "required": [
        "count",
        "paths",
        "records",
        "records_sha256",
        "current_bytes_required_to_match_historical"
      ],
      "properties": {
        "count": {"type": "integer"},
        "paths": {
          "type": "array",
          "uniqueItems": true,
          "items": {"$ref": "#/$defs/repoPath"}
        },
        "records": {
          "type": "array",
          "items": {"$ref": "#/$defs/fileRecord"}
        },
        "records_sha256": {"$ref": "#/$defs/sha256"},
        "current_bytes_required_to_match_historical": {"type": "boolean"}
      }
    },
    "e0MlAuthority": {
      "type": "object",
      "additionalProperties": false,
      "required": [
        "gate",
        "patch_head",
        "lock_commit",
        "lock",
        "companion_manifest",
        "superseded_components",
        "preserved_components",
        "publication_topology_verified",
        "historical_authority_verified",
        "effective_loader_called",
        "future_outcomes_accessed"
      ],
      "properties": {
        "gate": {"const": "E0-ML"},
        "patch_head": {"$ref": "#/$defs/gitOid"},
        "lock_commit": {"$ref": "#/$defs/gitOid"},
        "lock": {"$ref": "#/$defs/fileRecord"},
        "companion_manifest": {"$ref": "#/$defs/fileRecord"},
        "superseded_components": {"$ref": "#/$defs/componentSet"},
        "preserved_components": {"$ref": "#/$defs/componentSet"},
        "publication_topology_verified": {"const": true},
        "historical_authority_verified": {"const": true},
        "effective_loader_called": {"const": false},
        "future_outcomes_accessed": {"const": false}
      }
    },
    "e0MmAuthority": {
      "type": "object",
      "additionalProperties": false,
      "required": [
        "gate",
        "patch_head",
        "lock_commit",
        "lock",
        "companion_manifest",
        "preserved_components",
        "publication_topology_verified",
        "historical_authority_verified",
        "effective_loader_called",
        "future_outcomes_accessed"
      ],
      "properties": {
        "gate": {"const": "E0-MM"},
        "patch_head": {"$ref": "#/$defs/gitOid"},
        "lock_commit": {"$ref": "#/$defs/gitOid"},
        "lock": {"$ref": "#/$defs/fileRecord"},
        "companion_manifest": {"$ref": "#/$defs/fileRecord"},
        "preserved_components": {"$ref": "#/$defs/componentSet"},
        "publication_topology_verified": {"const": true},
        "historical_authority_verified": {"const": true},
        "effective_loader_called": {"const": false},
        "future_outcomes_accessed": {"const": false}
      }
    },
    "p1PublishedBundle": {
      "type": "object",
      "additionalProperties": false,
      "required": [
        "sequence_commit",
        "consumer_commit",
        "records",
        "records_sha256",
        "present_paths",
        "model_unavailable_semantics_verified",
        "sequence_commit_scope_verified",
        "consumer_commit_scope_verified",
        "completion_marker_written_last",
        "future_outcomes_accessed"
      ],
      "properties": {
        "sequence_commit": {"$ref": "#/$defs/gitOid"},
        "consumer_commit": {"$ref": "#/$defs/gitOid"},
        "records": {
          "type": "array",
          "minItems": 6,
          "maxItems": 6,
          "items": {"$ref": "#/$defs/fileRecord"}
        },
        "records_sha256": {"$ref": "#/$defs/sha256"},
        "present_paths": {
          "type": "array",
          "minItems": 6,
          "maxItems": 6,
          "uniqueItems": true,
          "items": {"$ref": "#/$defs/repoPath"}
        },
        "model_unavailable_semantics_verified": {"const": true},
        "sequence_commit_scope_verified": {"const": true},
        "consumer_commit_scope_verified": {"const": true},
        "completion_marker_written_last": {"const": true},
        "future_outcomes_accessed": {"const": false}
      }
    },
    "anfisStateBundle": {
      "type": "object",
      "additionalProperties": false,
      "required": [
        "publication_commit",
        "records",
        "records_sha256",
        "slot_status",
        "fit_status",
        "state_manifest_verified",
        "future_outcomes_accessed"
      ],
      "properties": {
        "publication_commit": {"$ref": "#/$defs/gitOid"},
        "records": {
          "type": "array",
          "minItems": 3,
          "maxItems": 3,
          "items": {"$ref": "#/$defs/fileRecord"}
        },
        "records_sha256": {"$ref": "#/$defs/sha256"},
        "slot_status": {"const": "available"},
        "fit_status": {"const": "passed"},
        "state_manifest_verified": {"const": true},
        "future_outcomes_accessed": {"const": false}
      }
    }
  },
  "type": "object",
  "additionalProperties": false,
  "required": [
    "lock_version",
    "status",
    "experiment_id",
    "surface_id",
    "gate",
    "patch_id",
    "created_at_utc",
    "patch_repository",
    "git_diff",
    "patch_components",
    "base_authorities",
    "p1_1729_publication",
    "p1_20260612_publication",
    "p1_20260613_publication",
    "p1_20260614_publication",
    "anfis_314159_state_bundle",
    "current_runtime_builder_record",
    "sequence_prelock",
    "progression_prelock",
    "sequence_atomicity",
    "correction",
    "verification",
    "authorizations",
    "seals",
    "lock_artifact"
  ],
  "properties": {
    "lock_version": {
      "const": "closure_p1_sequence_seed_314159_patch_lock_v1"
    },
    "status": {"const": "locked"},
    "experiment_id": {"const": "closure_v1"},
    "surface_id": {"const": "closure_v1_wqp_adaptive_no_current_chla"},
    "gate": {"const": "E0-MN"},
    "patch_id": {"const": "p1_sequence_seed_314159_authority_patch_1"},
    "created_at_utc": {
      "type": "string",
      "minLength": 20,
      "pattern": "(?:Z|[+-][0-9]{2}:[0-9]{2})$"
    },
    "patch_repository": {
      "type": "object",
      "additionalProperties": false,
      "required": [
        "head",
        "parent",
        "branch",
        "published_ref",
        "published_head",
        "remote_main_oid",
        "worktree_status",
        "exact_diff_verified"
      ],
      "properties": {
        "head": {"$ref": "#/$defs/gitOid"},
        "parent": {
          "const": "46daf1e2dd97a3d7e36ad187d4ae1510dfc14fc2"
        },
        "branch": {"const": "main"},
        "published_ref": {"const": "origin/main"},
        "published_head": {"$ref": "#/$defs/gitOid"},
        "remote_main_oid": {"$ref": "#/$defs/gitOid"},
        "worktree_status": {"const": "clean"},
        "exact_diff_verified": {"const": true}
      }
    },
    "git_diff": {
      "type": "object",
      "additionalProperties": false,
      "required": [
        "base_commit",
        "patch_head",
        "modified_count",
        "added_count",
        "entries",
        "paths",
        "paths_sha256",
        "only_allowed_additions_and_modifications"
      ],
      "properties": {
        "base_commit": {
          "const": "46daf1e2dd97a3d7e36ad187d4ae1510dfc14fc2"
        },
        "patch_head": {"$ref": "#/$defs/gitOid"},
        "modified_count": {"const": 2},
        "added_count": {"const": 5},
        "entries": {
          "type": "array",
          "minItems": 7,
          "maxItems": 7,
          "items": {"$ref": "#/$defs/diffEntry"}
        },
        "paths": {
          "type": "array",
          "minItems": 7,
          "maxItems": 7,
          "uniqueItems": true,
          "items": {"$ref": "#/$defs/repoPath"}
        },
        "paths_sha256": {"$ref": "#/$defs/sha256"},
        "only_allowed_additions_and_modifications": {"const": true}
      }
    },
    "patch_components": {
      "type": "object",
      "additionalProperties": false,
      "required": ["count", "paths", "paths_sha256", "records", "records_sha256"],
      "properties": {
        "count": {"const": 7},
        "paths": {
          "type": "array",
          "minItems": 7,
          "maxItems": 7,
          "uniqueItems": true,
          "items": {"$ref": "#/$defs/repoPath"}
        },
        "paths_sha256": {"$ref": "#/$defs/sha256"},
        "records": {
          "type": "array",
          "minItems": 7,
          "maxItems": 7,
          "items": {"$ref": "#/$defs/fileRecord"}
        },
        "records_sha256": {"$ref": "#/$defs/sha256"}
      }
    },
    "base_authorities": {
      "type": "object",
      "additionalProperties": false,
      "required": ["e0_ml", "e0_mm"],
      "properties": {
        "e0_ml": {"$ref": "#/$defs/e0MlAuthority"},
        "e0_mm": {"$ref": "#/$defs/e0MmAuthority"}
      }
    },
    "p1_1729_publication": {"$ref": "#/$defs/p1PublishedBundle"},
    "p1_20260612_publication": {"$ref": "#/$defs/p1PublishedBundle"},
    "p1_20260613_publication": {"$ref": "#/$defs/p1PublishedBundle"},
    "p1_20260614_publication": {"$ref": "#/$defs/p1PublishedBundle"},
    "anfis_314159_state_bundle": {"$ref": "#/$defs/anfisStateBundle"},
    "current_runtime_builder_record": {"$ref": "#/$defs/fileRecord"},
    "sequence_prelock": {
      "type": "object",
      "additionalProperties": false,
      "required": [
        "model_id",
        "base_seed",
        "count",
        "paths",
        "paths_sha256",
        "all_absent_at_lock"
      ],
      "properties": {
        "model_id": {"const": "P1"},
        "base_seed": {"const": 314159},
        "count": {"const": 28},
        "paths": {
          "type": "array",
          "minItems": 28,
          "maxItems": 28,
          "uniqueItems": true,
          "items": {"$ref": "#/$defs/repoPath"}
        },
        "paths_sha256": {"$ref": "#/$defs/sha256"},
        "all_absent_at_lock": {"const": true}
      }
    },
    "progression_prelock": {
      "type": "object",
      "additionalProperties": false,
      "required": [
        "p1_seed_order",
        "p1_path_count",
        "p1_paths_sha256",
        "completed_seeds",
        "completed_seed_present_count",
        "completed_seed_present_paths",
        "remaining_absent_count",
        "remaining_absent_paths_sha256",
        "prior_seed_residual_absent_count",
        "target_seed_absent_count",
        "later_seed_absent_count",
        "next_authorized_seed",
        "e0_m_output_count",
        "outcome_access_log_state",
        "future_outcomes_accessed"
      ],
      "properties": {
        "p1_seed_order": {
          "const": [1729, 20260612, 20260613, 20260614, 314159]
        },
        "p1_path_count": {"const": 140},
        "p1_paths_sha256": {"$ref": "#/$defs/sha256"},
        "completed_seeds": {"const": [1729, 20260612, 20260613, 20260614]},
        "completed_seed_present_count": {"const": 24},
        "completed_seed_present_paths": {
          "type": "array",
          "minItems": 24,
          "maxItems": 24,
          "uniqueItems": true,
          "items": {"$ref": "#/$defs/repoPath"}
        },
        "remaining_absent_count": {"const": 116},
        "remaining_absent_paths_sha256": {"$ref": "#/$defs/sha256"},
        "prior_seed_residual_absent_count": {"const": 88},
        "target_seed_absent_count": {"const": 28},
        "later_seed_absent_count": {"const": 0},
        "next_authorized_seed": {"const": 314159},
        "e0_m_output_count": {"const": 0},
        "outcome_access_log_state": {"const": "absent"},
        "future_outcomes_accessed": {"const": false}
      }
    },
    "sequence_atomicity": {
      "const": {
        "bundle_outputs": ["sequence_parquet", "summary_csv", "manifest_json"],
        "completion_marker": "manifest_json",
        "completion_marker_written_last": true,
        "dependencies_revalidated_at_commit": true,
        "directory_fsync": true,
        "dvc_pointer_checks": [
          "preflight",
          "before_manifest",
          "after_manifest",
          "transaction_commit_before_output_rehash",
          "transaction_commit_after_dependency_revalidation"
        ],
        "exclusive_slot_guard": true,
        "foreign_replacement_preserved": true,
        "owned_bytes_rehashed_at_commit": true,
        "parent_walk_no_follow": true,
        "publication": "hardlink_no_clobber",
        "publication_order": ["sequence_parquet", "summary_csv", "manifest_json"],
        "rollback": "reverse_owned_inode_only",
        "sigkill_between_distinct_directories_is_detected_not_atomic": true,
        "temporary_creation": "exclusive_regular_inode",
        "uncoordinated_external_dvc_creator_excluded": false
      }
    },
    "correction": {
      "const": {
        "issue_id": "p1_sequence_next_seed_authority_1",
        "classification": "ordered_seed_progression_authority_only",
        "historical_e0_ml_effective_loader_called": false,
        "historical_e0_mm_effective_loader_called": false,
        "p1_1729_consumer_preserved": true,
        "p1_20260612_consumer_preserved": true,
        "p1_20260613_consumer_preserved": true,
        "p1_20260614_consumer_preserved": true,
        "authorized_next_seed": 314159,
        "scientific_sequence_contract_changed": false,
        "state_mapping_changed": false,
        "denominator_changed": false,
        "outcome_access_changed": false
      }
    },
    "verification": {
      "type": "object",
      "additionalProperties": false,
      "required": [
        "schema_subset_preflight",
        "full_type_check",
        "focused_tests",
        "poetry_check",
        "publication_guard",
        "git_diff_check"
      ],
      "properties": {
        "schema_subset_preflight": {"$ref": "#/$defs/schemaSubsetPreflight"},
        "full_type_check": {"$ref": "#/$defs/commandEvidence"},
        "focused_tests": {"$ref": "#/$defs/focusedCommandEvidence"},
        "poetry_check": {"$ref": "#/$defs/commandEvidence"},
        "publication_guard": {"$ref": "#/$defs/commandEvidence"},
        "git_diff_check": {"$ref": "#/$defs/commandEvidence"}
      }
    },
    "authorizations": {
      "const": {
        "prior_p1_1729_slot_completed": true,
        "prior_p1_20260612_slot_completed": true,
        "prior_p1_20260613_slot_completed": true,
        "prior_p1_20260614_slot_completed": true,
        "authorized_model_id": "P1",
        "authorized_base_seed": 314159,
        "p1_sequence_builder_authorized": false,
        "effective_in_payload": false,
        "publication_required": true,
        "batch_seed_execution_authorized": false,
        "retry_authorized": false,
        "p1_consumer_authorized": false,
        "p1_fit_authorized": false,
        "fit_attempt_authorized": false,
        "replacement_authorized": false,
        "dvc_commands_authorized": false,
        "e0_m_authorized": false,
        "evaluation_authorized": false,
        "e0_u_authorized": false,
        "future_outcomes_accessed": false
      }
    },
    "seals": {
      "const": {
        "e0_ml_preserved_as_historical_authority": true,
        "e0_mm_preserved_as_historical_authority": true,
        "p1_1729_sequence_bundle_preserved": true,
        "p1_1729_consumer_bundle_preserved": true,
        "p1_20260612_sequence_bundle_preserved": true,
        "p1_20260612_consumer_bundle_preserved": true,
        "p1_20260613_sequence_bundle_preserved": true,
        "p1_20260613_consumer_bundle_preserved": true,
        "p1_20260614_sequence_bundle_preserved": true,
        "p1_20260614_consumer_bundle_preserved": true,
        "anfis_314159_state_bundle_preserved": true,
        "only_builder_and_test_superseded_from_e0_ml": true,
        "target_seed_namespace_absent_at_lock": true,
        "later_seed_namespaces_absent_at_lock": true,
        "scientific_sequence_contract_changed": false,
        "seed_order_changed": false,
        "holdout_accessed": false,
        "post_2021_outcomes_accessed": false,
        "does_not_replace_e0_m": true
      }
    },
    "lock_artifact": {
      "const": {
        "path": "reports/closure_v1/00_protocol/p1_sequence_seed_314159_patch_lock.json",
        "role": "external_p1_sequence_seed_314159_patch_lock",
        "self_hash_policy": "verified_from_committed_and_published_bytes"
      }
    }
  }
}
