{
  "anfis_314159_state_bundle": {
    "fit_status": "passed",
    "future_outcomes_accessed": false,
    "publication_commit": "45705d620ad529b702624706b07e8a39fc138f72",
    "records": [
      {
        "bytes": 1214293,
        "path": "data/closure_v1/development/anfis/seed_314159/adaptive_no_current_state.parquet",
        "role": "anfis_314159_state_parquet",
        "sha256": "53e71211cf0f58f78bb473869dcac7e15b578c39d6722eba02954c13a86101f0"
      },
      {
        "bytes": 116,
        "path": "data/closure_v1/development/anfis/seed_314159/adaptive_no_current_state.parquet.dvc",
        "role": "anfis_314159_state_pointer",
        "sha256": "1c91d9c32feb0fbafe427e1d1f8c9e6252cb37570e0ae819ba54f587a6d4c181"
      },
      {
        "bytes": 20821,
        "path": "reports/closure_v1/01_surface/anfis/seed_314159/manifest.json",
        "role": "anfis_314159_state_manifest",
        "sha256": "dedcc82dd998499fa5f3f8049554431b1e97dcf6dff32645e7e6bf4e5240f2f4"
      }
    ],
    "records_sha256": "07a026246aac677db5e4ee33c441ba4e70687735f2f2f43c1bee0e2d7ba19754",
    "slot_status": "available",
    "state_manifest_verified": true
  },
  "authorizations": {
    "authorized_base_seed": 314159,
    "authorized_model_id": "P1",
    "batch_seed_execution_authorized": false,
    "dvc_commands_authorized": false,
    "e0_m_authorized": false,
    "e0_u_authorized": false,
    "effective_in_payload": false,
    "evaluation_authorized": false,
    "fit_attempt_authorized": false,
    "future_outcomes_accessed": false,
    "p1_consumer_authorized": false,
    "p1_fit_authorized": false,
    "p1_sequence_builder_authorized": false,
    "prior_p1_1729_slot_completed": true,
    "prior_p1_20260612_slot_completed": true,
    "prior_p1_20260613_slot_completed": true,
    "prior_p1_20260614_slot_completed": true,
    "publication_required": true,
    "replacement_authorized": false,
    "retry_authorized": false
  },
  "base_authorities": {
    "e0_ml": {
      "companion_manifest": {
        "bytes": 9256,
        "path": "reports/closure_v1/00_protocol/p1_sequence_seed_20260614_patch_lock_manifest.json",
        "role": "p1_sequence_seed_20260614_patch_companion",
        "sha256": "e157595b9ded45965bd40c181c625c2413b8a3534ea9d672ee35be56cd13d818"
      },
      "effective_loader_called": false,
      "future_outcomes_accessed": false,
      "gate": "E0-ML",
      "historical_authority_verified": true,
      "lock": {
        "bytes": 31537,
        "path": "reports/closure_v1/00_protocol/p1_sequence_seed_20260614_patch_lock.json",
        "role": "external_p1_sequence_seed_20260614_patch_lock",
        "sha256": "e8f111bdfb3761ff23faaeff15bfc01454bdc5e1659fccb02d43d2a3d89a25c1"
      },
      "lock_commit": "fa18ac0e8542ac41ab8bb9413fe085ac0e5f2bca",
      "patch_head": "b30bf68caaee84af2b477ecc36a35fdb2d1cd076",
      "preserved_components": {
        "count": 5,
        "current_bytes_required_to_match_historical": true,
        "paths": [
          "configs/closure_v1/p1_sequence_seed_20260614_patch_lock.schema.json",
          "docs/closure_v1/E0_M_P1_SEQUENCE_SEED_20260614_PATCH_1.md",
          "src/experiments/closure_p1_sequence_seed_20260614_patch.py",
          "src/experiments/lock_closure_p1_sequence_seed_20260614_patch.py",
          "tests/test_closure_p1_sequence_seed_20260614_patch.py"
        ],
        "records": [
          {
            "bytes": 19340,
            "path": "configs/closure_v1/p1_sequence_seed_20260614_patch_lock.schema.json",
            "role": "p1_sequence_seed_20260614_patch_lock_schema",
            "sha256": "904b441c44729fed7b76246143b2ea80fc264b09b297e7a6861701322b112662"
          },
          {
            "bytes": 4141,
            "path": "docs/closure_v1/E0_M_P1_SEQUENCE_SEED_20260614_PATCH_1.md",
            "role": "p1_sequence_seed_20260614_patch_protocol",
            "sha256": "1993220179285cb6bd5efc4324da893d080daf3a3534e22d144e8b391eafd313"
          },
          {
            "bytes": 88061,
            "path": "src/experiments/closure_p1_sequence_seed_20260614_patch.py",
            "role": "p1_sequence_seed_20260614_patch_validator",
            "sha256": "e0ca05353e980534686fb0555ffca0c776d255b3c01d8c4acbf8c56dc156a3bc"
          },
          {
            "bytes": 36170,
            "path": "src/experiments/lock_closure_p1_sequence_seed_20260614_patch.py",
            "role": "p1_sequence_seed_20260614_patch_locker",
            "sha256": "32b68ab6033d2b49c06aa4677f4e99c047aab4ca54246b3d376fdb2290915819"
          },
          {
            "bytes": 38576,
            "path": "tests/test_closure_p1_sequence_seed_20260614_patch.py",
            "role": "p1_sequence_seed_20260614_patch_tests",
            "sha256": "35f031b5d9c5cfa1c262ff3a4e5565f474a79efc39533892496c324a4727984a"
          }
        ],
        "records_sha256": "6f968aad5cc5be07f3ef4144d628db27e02ecbe94ccd101a6ae951255b85f4cb"
      },
      "publication_topology_verified": true,
      "superseded_components": {
        "count": 2,
        "current_bytes_required_to_match_historical": false,
        "paths": [
          "src/experiments/build_closure_pipe_sequences.py",
          "tests/test_build_closure_pipe_sequences.py"
        ],
        "records": [
          {
            "bytes": 127863,
            "path": "src/experiments/build_closure_pipe_sequences.py",
            "role": "p1_sequence_seed_20260614_gate_routing",
            "sha256": "0b470777f52c25c59a42d18e672315b7a4d1799b4565bbe468b7d4f1972ee564"
          },
          {
            "bytes": 76105,
            "path": "tests/test_build_closure_pipe_sequences.py",
            "role": "p1_sequence_seed_20260614_builder_gate_tests",
            "sha256": "1dda6db3930a9aadad1b8f31aa81f8a40ae24e57d6c0b5de7462b0e217e4ae94"
          }
        ],
        "records_sha256": "6df0ccd5176a0550d24076f5c578a8352fe9586b994c65dcc216280b8f2da50d"
      }
    },
    "e0_mm": {
      "companion_manifest": {
        "bytes": 8850,
        "path": "reports/closure_v1/00_protocol/p1_temporal_consumer_seed_20260614_patch_lock_manifest.json",
        "role": "p1_temporal_consumer_seed_20260614_patch_companion",
        "sha256": "f06c82dfc52fd16a23d61a7e1ce515f9d01a9ba4f0c528d790fd9f160e7acc08"
      },
      "effective_loader_called": false,
      "future_outcomes_accessed": false,
      "gate": "E0-MM",
      "historical_authority_verified": true,
      "lock": {
        "bytes": 39951,
        "path": "reports/closure_v1/00_protocol/p1_temporal_consumer_seed_20260614_patch_lock.json",
        "role": "external_p1_temporal_consumer_seed_20260614_patch_lock",
        "sha256": "cc2b8725c03b297ae16763131b4bd2999dad60e17e1b1c27d9baea3783c4b5e5"
      },
      "lock_commit": "e216bf4f080d98895aa52d18c0f278ff72c6acb4",
      "patch_head": "f6cd0bfeaddf9a393588924072fab93e89e739db",
      "preserved_components": {
        "count": 7,
        "current_bytes_required_to_match_historical": true,
        "paths": [
          "configs/closure_v1/p1_temporal_consumer_seed_20260614_patch_lock.schema.json",
          "docs/closure_v1/E0_M_P1_TEMPORAL_CONSUMER_SEED_20260614_PATCH_1.md",
          "src/experiments/closure_p1_temporal_consumer_seed_20260614_patch.py",
          "src/experiments/lock_closure_p1_temporal_consumer_seed_20260614_patch.py",
          "src/experiments/train_closure_pipe.py",
          "tests/test_closure_p1_temporal_consumer_seed_20260614_patch.py",
          "tests/test_train_closure_pipe.py"
        ],
        "records": [
          {
            "bytes": 22927,
            "path": "configs/closure_v1/p1_temporal_consumer_seed_20260614_patch_lock.schema.json",
            "role": "p1_temporal_consumer_seed_20260614_patch_lock_schema",
            "sha256": "6d3e094526bd17848538db9a59d9400e010de39d8db3d465284eac537e91e92b"
          },
          {
            "bytes": 5537,
            "path": "docs/closure_v1/E0_M_P1_TEMPORAL_CONSUMER_SEED_20260614_PATCH_1.md",
            "role": "p1_temporal_consumer_seed_20260614_patch_protocol",
            "sha256": "d1500eb50e1e6a4e6a64f6187b2208aa035005d287ee6575ac817db46cd2f584"
          },
          {
            "bytes": 79704,
            "path": "src/experiments/closure_p1_temporal_consumer_seed_20260614_patch.py",
            "role": "p1_temporal_consumer_seed_20260614_patch_validator",
            "sha256": "28932a83a8ae0c9629b029ccdf84dc79b2702a1bff496d6390112d35a04b90e1"
          },
          {
            "bytes": 22411,
            "path": "src/experiments/lock_closure_p1_temporal_consumer_seed_20260614_patch.py",
            "role": "p1_temporal_consumer_seed_20260614_patch_locker",
            "sha256": "05ac1b75b49a556787f7843c9f2cbd0dcc66841c1de90ddb9c13f78f727769c7"
          },
          {
            "bytes": 142546,
            "path": "src/experiments/train_closure_pipe.py",
            "role": "p1_temporal_consumer_mm_gate_routing",
            "sha256": "5d0a5a6fa5525bdd7e6313d00c78787dd51206f714212a19c95aaf50f63d1706"
          },
          {
            "bytes": 35026,
            "path": "tests/test_closure_p1_temporal_consumer_seed_20260614_patch.py",
            "role": "p1_temporal_consumer_seed_20260614_patch_tests",
            "sha256": "92349e5d3f3259a5a45f24d058a47ecde549a6147419545152687f2699341cea"
          },
          {
            "bytes": 114965,
            "path": "tests/test_train_closure_pipe.py",
            "role": "p1_temporal_consumer_mm_gate_tests",
            "sha256": "0add3a06b50ef8299b6646d08978b23ba474a93c7b45cd09c4e62b6cd4817712"
          }
        ],
        "records_sha256": "c1c8cce050a044d2a382cd69d6bd9491d41a5a80d84eef48e29f12c0b16afa5a"
      },
      "publication_topology_verified": true
    }
  },
  "correction": {
    "authorized_next_seed": 314159,
    "classification": "ordered_seed_progression_authority_only",
    "denominator_changed": false,
    "historical_e0_ml_effective_loader_called": false,